Sheet: BOM Costing
A1: MSP430FR2000 Train Horn
A2: BOM Cost
A3: Reference | B3: Value | C3: Manufacture | D3: Mfg Part Number | E3: Description | F3: Suppler | G3: Supplier Part Number | H3: Purchase Cost | I3: Purchase Quantity | J3: Unit Cost | K3: Build Quantity Used | L3: Build Cost
C4: PCBWay | E4: PCB | H4: of:=5+21-1+2 -> 27 | I4: 10 | J4: of:=[.H4]/[.I4] -> 2.7 | K4: 1 | L4: of:=[.J4]*[.K4] -> 2.7
A5: BT1 | B5: 18650 | C5: MPD | D5: BH-18650-PC-ND | E5: HOLDER BATT 18650 1CELL PC PIN | F5: eBay | G5: 132088828126 | H5: 7.87 | I5: 10 | J5: of:=[.H5]/[.I5] -> 0.787 | K5: 1 | L5: of:=[.J5]*[.K5] -> 0.787
A6: C1 | B6: 4.7uF | C6: Samsung Electro-Mechanics | D6: CL21A475KQFNNNG | E6: CAP CER 4.7UF 6.3V X5R 0805 | F6: DigiKey | G6: 1276-6465-1-ND | H6: 3.85 | I6: 100 | J6: of:=[.H6]/[.I6] -> 0.0385 | K6: 2 | L6: of:=[.J6]*[.K6] -> 0.077
A7: C4
A8: C2 | B8: 100nF | C8: Samsung Electro-Mechanics | D8: CL21B104KOANNNC | E8: CAP CER 0.1UF 16V X7R 0805 | F8: DigiKey | G8: 1276-2448-1-ND | H8: 4.43 | I8: 500 | J8: of:=[.H8]/[.I8] -> 0.00886 | K8: 11 | L8: of:=[.J8]*[.K8] -> 0.09746
A9: C6
A10: C8
A11: C9
A12: C10
A13: C11
A14: C12
A15: C13
A16: C14
A17: C15
A18: C16
A19: C3 | B19: 1uF | C19: Samsung Electro-Mechanics | D19: CL21B105KOFNNNG | E19: CAP CER 1UF 16V X7R 0805 | F19: DigiKey | G19: 1276-6471-1-ND | H19: 7.39 | I19: 500 | J19: of:=[.H19]/[.I19] -> 0.01478 | K19: 4 | L19: of:=[.J19]*[.K19] -> 0.05912
A20: C5
A21: C7
A22: C20
A23: C17 | B23: 0.22uF | C23: Samsung Electro-Mechanics | D23: CL21B224KAFNNNG | E23: CAP CER 0.22UF 25V X7R 0805 | F23: DigiKey | G23: 1276-6447-1-ND | H23: 2.71 | I23: 100 | J23: of:=[.H23]/[.I23] -> 0.0271 | K23: 3 | L23: of:=[.J23]*[.K23] -> 0.0813
A24: C18 | B24: 0.22uF | C24: Samsung Electro-Mechanics | D24: CL21B224KAFNNNG | E24: CAP CER 0.22UF 25V X7R 0805 | F24: DigiKey
A25: C19 | B25: 0.22uF | C25: Samsung Electro-Mechanics | D25: CL21B224KAFNNNG | E25: CAP CER 0.22UF 25V X7R 0805 | F25: DigiKey
A26: D1 | B26: BLUE | C26: Wurth Electronics Inc. | D26: 150080BS75000 | E26: LED BLUE CLEAR 0805 SMD | F26: DigiKey | G26: 732-4982-1-ND | H26: 8 | I26: 50 | J26: of:=[.H26]/[.I26] -> 0.16 | K26: 1 | L26: of:=[.J26]*[.K26] -> 0.16
A27: D2 | B27: RED | C27: Wurth Electronics Inc. | D27: 150080RS75000 | E27: LED RED CLEAR 0805 SMD | F27: DigiKey | G27: 732-4984-1-ND | H27: 8 | I27: 50 | J27: of:=[.H27]/[.I27] -> 0.16 | K27: 1 | L27: of:=[.J27]*[.K27] -> 0.16
A28: D3 | B28: GREEN | C28: Wurth Electronics Inc. | D28: 150080GS75000 | E28: LED GREEN CLEAR 0805 SMD | F28: DigiKey | G28: 732-4983-1-ND | H28: 8 | I28: 50 | J28: of:=[.H28]/[.I28] -> 0.16 | K28: 1 | L28: of:=[.J28]*[.K28] -> 0.16
A29: J1 | B29: USB_OTG | C29: Amphenol | D29: 10118192-0001LF | E29: CONN USB MICRO B RECPT SMT R/A | F29: DigiKey | G29: 609-4613-1-ND | H29: 6.12 | I29: 14 | J29: of:=[.H29]/[.I29] -> 0.437142857142857 | K29: 1 | L29: of:=[.J29]*[.K29] -> 0.437142857142857
A30: JP1 | B30: JUMPER | C30: Yageo | D30: RC1206JR-070RL | E30: RES SMD 0 OHM JUMPER 1/4W 1206 | F30: DigiKey | G30: 311-0.0ERCT-ND | H30: 4.35 | I30: 1000 | J30: of:=[.H30]/[.I30] -> 0.00435 | K30: 7 | L30: of:=[.J30]*[.K30] -> 0.03045
A31: JP3
A32: JP4
A33: JP5
A34: JP6
A35: JP7
A36: JP8
A37: LS1 | B37: SPEAKER TERMINAL | E37: 2POS 5MM SCREW TERMINAL BLOCK | F37: eBay | G37: 192346900934 | H37: 2.33 | I37: 40 | J37: of:=[.H37]/[.I37] -> 0.05825 | K37: 1 | L37: of:=[.J37]*[.K37] -> 0.05825
A38: Q1 | B38: 2N7002 | C38: Vishay Siliconix | D38: 2N7002K-T1-E3 | E38: MOSFET N-CH 60V 300MA SOT-23 | F38: DigiKey | G38: 2N7002K-T1-E3CT-ND | H38: 3.32 | I38: 20 | J38: of:=[.H38]/[.I38] -> 0.166 | K38: 1 | L38: of:=[.J38]*[.K38] -> 0.166
A39: R1 | B39: 100K | C39: Yageo | D39: RC0805FR-07100KL | E39: RES SMD 100K OHM 1% 1/8W 0805 | F39: DigiKey | G39: 311-100KCRCT-ND | H39: 3.96 | I39: 1000 | J39: of:=[.H39]/[.I39] -> 0.00396 | K39: 2 | L39: of:=[.J39]*[.K39] -> 0.00792
A40: R4
A41: R2 | B41: 56K | C41: Rohm Semiconductor | D41: MCR10ERTF5602 | E41: RES SMD 56K OHM 1% 1/8W 0805 | F41: DigiKey | G41: RHM56KCHCT-ND | H41: 1.63 | I41: 1000 | J41: of:=[.H41]/[.I41] -> 0.00163 | K41: 1 | L41: of:=[.J41]*[.K41] -> 0.00163
A42: R3 | B42: 470 | C42: Yageo | D42: RC0805FR-07470RL | E42: RES SMD 470 OHM 1% 1/8W 0805 | F42: DigiKey | G42: 311-470CRCT-ND | H42: 3.96 | I42: 1000 | J42: of:=[.H42]/[.I42] -> 0.00396 | K42: 1 | L42: of:=[.J42]*[.K42] -> 0.00396
A43: R5 | B43: 1K | C43: Yageo | D43: RC0805FR-071KL | E43: RES SMD 1K OHM 1% 1/8W 0805 | F43: DigiKey | G43: 311-1.00KCRCT-ND | H43: 3.96 | I43: 1000 | J43: of:=[.H43]/[.I43] -> 0.00396 | K43: 2 | L43: of:=[.J43]*[.K43] -> 0.00792
A44: R14
A45: R6 | B45: 2k | C45: Yageo | D45: RC0805FR-072KL | E45: RES SMD 2K OHM 1% 1/8W 0805 | F45: DigiKey | G45: 311-2.00KCRCT-ND | H45: 3.96 | I45: 1000 | J45: of:=[.H45]/[.I45] -> 0.00396 | K45: 1 | L45: of:=[.J45]*[.K45] -> 0.00396
A46: R8 | B46: 6.2k | C46: Yageo | D46: RC0805FR-076K2L | E46: RES SMD 6.2K OHM 1% 1/8W 0805 | F46: DigiKey | G46: 311-6.20KCRCT-ND | H46: 3.96 | I46: 1000 | J46: of:=[.H46]/[.I46] -> 0.00396 | K46: 3 | L46: of:=[.J46]*[.K46] -> 0.01188
A47: R11
A48: R15
A49: R9 | B49: 5.1k | C49: Yageo | D49: RC0805FR-075K1L | E49: RES SMD 5.1K OHM 1% 1/8W 0805 | F49: DigiKey | G49: 311-5.10KCRCT-ND | H49: 3.96 | I49: 1000 | J49: of:=[.H49]/[.I49] -> 0.00396 | K49: 3 | L49: of:=[.J49]*[.K49] -> 0.01188
A50: R12
A51: R16
A52: R10 | B52: 3.6k | C52: Yageo | D52: RC0805FR-073K6L | E52: RES SMD 3.6K OHM 1% 1/8W 0805 | F52: DigiKey | G52: 311-3.60KCRCT-ND | H52: 3.96 | I52: 1000 | J52: of:=[.H52]/[.I52] -> 0.00396 | K52: 3 | L52: of:=[.J52]*[.K52] -> 0.01188
A53: R13
A54: R17
A55: R18 | B55: 10k | C55: Yageo | D55: RC0805FR-0710KL | E55: RES SMD 10K OHM 1% 1/8W 0805 | F55: DigiKey | G55: 311-10.0KCRCT-ND | H55: 3.96 | I55: 1000 | J55: of:=[.H55]/[.I55] -> 0.00396 | K55: 8 | L55: of:=[.J55]*[.K55] -> 0.03168
A56: R19
A57: R20
A58: R21
A59: R22
A60: R23
A61: R24
A62: R25
A63: SW1 | B63: PLAY | C63: Panasonic Electronic Components | D63: EVQ-P7C01P | E63: SWITCH TACTILE SPST-NO 0.05A 12V | F63: DigiKey | G63: P16765CT-ND | H63: 7.24 | I63: 25 | J63: of:=[.H63]/[.I63] -> 0.2896 | K63: 1 | L63: of:=[.J63]*[.K63] -> 0.2896
A64: U1 | B64: MIC7221 | C64: Microchip Technology | D64: MIC7221YM5-TR | E64: IC COMPARATOR R-R SOT-23-5 | F64: DigiKey | G64: 576-2901-1-ND | H64: 5.83 | I64: 25 | J64: of:=[.H64]/[.I64] -> 0.2332 | K64: 1 | L64: of:=[.J64]*[.K64] -> 0.2332
A65: U2 | B65: MCP73831 | C65: Microchip Technology | D65: MCP73831T-2ACI/OT | E65: IC CONTROLLR LI-ION 4.2V SOT23-5 | F65: DigiKey | G65: MCP73831T-2ACI/OTCT-ND | H65: 5.6 | I65: 10 | J65: of:=[.H65]/[.I65] -> 0.56 | K65: 1 | L65: of:=[.J65]*[.K65] -> 0.56
A66: U3 | B66: TPS78233DDCR | C66: Texas Instruments | D66: TPS78233DDCR | E66: IC REG LINEAR 3.3V 150MA SOT23-5 | F66: DigiKey | G66: 296-24059-1-ND | H66: 7.34 | I66: 10 | J66: of:=[.H66]/[.I66] -> 0.734 | K66: 1 | L66: of:=[.J66]*[.K66] -> 0.734
A67: U4 | B67: MSP430FR2000_TSSOP | C67: Texas Instruments | D67: MSP430FR2000IPW16 | E67: 16 MHZ ULTRA-LOW-POWER MICROCONT | F67: DigiKey | G67: 296-47170-ND | H67: 8.11 | I67: 10 | J67: of:=[.H68]/[.I67] -> 0.924 | K67: 1 | L67: of:=[.J67]*[.K67] -> 0.924
A68: U5 | B68: TPA6211A1 | C68: Texas Instruments | D68: TPA6211A1DGNR | E68: IC AMP AUDIO PWR 3.1W MONO 8MSOP | F68: DigiKey | G68: 296-26889-1-ND | H68: 9.24 | I68: 10 | J68: of:=[.H68]/[.I68] -> 0.924 | K68: 1 | L68: of:=[.J68]*[.K68] -> 0.924
K69: Total Unit Cost | L69: of:=SUM([.L4:.L68]) -> 8.73123285714286

Sheet: Tindie Pricing
A1: Build Cost | B1: of:=[$'BOM Costing'.L69] -> 8.73123285714286
A2: Markup Multiplier | B2: 2.5
A3: Selling Price | B3: of:=[.B1]*[.B2] -> 21.8280821428571
A4: Shipping Cost | B4: 3.68
A5: Total Cost To Customer | B5: of:=[.B4]+[.B3] -> 25.5080821428571
A6: Tindie Fee | B6: of:=[.B5]*[.C6] -> 1.27540410714286 | C6: 0.05
A7: Payment Processing Fee | B7: of:=([.B5]*[.C7])+[.D7] -> 1.32032328571429 | C7: 0.04 | D7: 0.3
A8: Tindie Disbursement | B8: of:=[.B3]-[.B6]-[.B7] -> 19.23235475
A9: Profit | B9: of:=[.B8]-[.B1] -> 10.5011218928571